{
  "schemaVersion": 1,
  "updatedAt": "2026-09-15",
  "validationLevels": [
    {
      "id": "L0",
      "name": "Discovered",
      "description": "The project was located, but its source and runtime behavior have not been reviewed."
    },
    {
      "id": "L1",
      "name": "Source reviewed",
      "description": "Package metadata, composition files, lifecycle scripts, permissions, and obvious risks were reviewed."
    },
    {
      "id": "L2",
      "name": "Import compatible",
      "description": "Static dependency analysis and a real host-entry import probe passed in the named environment."
    },
    {
      "id": "L3",
      "name": "Composition mounted",
      "description": "An isolated DSH profile started with all expected Cordis rows active and tools registered."
    },
    {
      "id": "L4",
      "name": "Functional smoke",
      "description": "At least one representative end-to-end capability completed successfully in a controlled target."
    },
    {
      "id": "L5",
      "name": "Deployment validated",
      "description": "Exact source or artifact identity, acceptance checks, security notes, and rollback steps are recorded."
    },
    {
      "id": "baseline",
      "name": "Locked baseline",
      "description": "The exact component is part of a maintained deployment lock and its complete acceptance contract."
    }
  ],
  "suites": [
    {
      "id": "windows-companion-suite",
      "displayName": "Windows companion suite",
      "profile": "web",
      "members": [
        {
          "plugin": "dsh-github-copilot",
          "requiredByBaseDeployment": true
        },
        {
          "plugin": "dsh-cron",
          "requiredByBaseDeployment": false
        },
        {
          "plugin": "dsh-playwright-host",
          "requiredByBaseDeployment": false
        }
      ]
    }
  ],
  "plugins": [
    {
      "id": "dsh-github-copilot",
      "displayName": "DSH GitHub Copilot",
      "package": "dsh-github-copilot",
      "categories": [
        "model-provider",
        "search"
      ],
      "integration": "cordis",
      "artifact": {
        "name": "dsh-github-copilot-0.4.0-alpha.18.tgz",
        "url": "https://github.com/cloga/dsh-github-copilot/releases/download/v0.4.0-alpha.18/dsh-github-copilot-0.4.0-alpha.18.tgz",
        "sha256": "2ca4f604e89eda3000cf2a51d79871cee3cb721fa6f4324fc9a1197926c359a8",
        "sha512": "15975665b6ff2bc8e613ae06c1bf5953e5000c0a9a9007ea2d7aebbbfaa92c5492e2a0b82cc3b4b88714d4a6ecc350a0e79c5fd2af9949b9f4cb771dc83ccb5f",
        "integrity": "sha512-FZdWZbb/K8jmE64Gwb9ZU+UADAqakAfqLXrru/qpLFSS4qC4LMO0uIcU1Kbsw1Cg55xf0q+ZSbn0y3cdyDzLXw==",
        "releaseTag": "v0.4.0-alpha.18",
        "releaseCommit": "08bfccc3b5930b93ef2fe31d9cf9e509f34a8704",
        "releaseImmutable": true,
        "checksumManifestUrl": "https://github.com/cloga/dsh-github-copilot/releases/download/v0.4.0-alpha.18/SHA256SUMS",
        "size": 538911,
        "checksumManifestSha256": "caf7a63a46764b499df15acd6eca020b449ca34bd868f7064712c29df53a5293",
        "checksumManifestSize": 104
      },
      "source": {
        "repository": "https://github.com/cloga/dsh-github-copilot",
        "commit": "08bfccc3b5930b93ef2fe31d9cf9e509f34a8704",
        "reviewedHead": "08bfccc3b5930b93ef2fe31d9cf9e509f34a8704",
        "mergeCommit": "08bfccc3b5930b93ef2fe31d9cf9e509f34a8704",
        "pullRequest": 120,
        "release": "0.4.0-alpha.18"
      },
      "platforms": [
        "cross-platform"
      ],
      "recommendation": "recommended",
      "validation": {
        "level": "baseline",
        "verifiedAt": "2026-09-14",
        "dshVersion": "official Desktop-managed 0.1.5-rc.2",
        "nodeVersion": "24.19.0",
        "evidence": [
          {
            "kind": "deployment-lock",
            "description": "The Windows Copilot deployment lock pins official Desktop 0.10.3, its eight Profile links, its non-bundled panel placeholder, and its exact Desktop-managed DSH runtime together with the Copilot artifact, source commit, build commands, and required capabilities.",
            "path": "deployments/windows-copilot.lock.json"
          },
          {
            "kind": "import-probe",
            "description": "The maintained web and headless Profiles completed real host-entry import probes without fatal imports.",
            "path": "docs/local-core-desktop-copilot.md"
          },
          {
            "kind": "composition-mount",
            "description": "The validated Profiles loaded the expected plugin composition and registered the supported capabilities.",
            "path": "docs/local-core-desktop-copilot.md"
          },
          {
            "kind": "functional-smoke",
            "description": "The official Desktop-managed rc.1 runtime, strict Remote codecs and OAuth JSON normalization, authorization fallback, leaf-only account model reconciliation, mixed per-model protocols, Copilot-scoped removal of unusable escalation fields, direct GitHub-hosted and Enterprise Copilot endpoints, dual-protocol inline search, Responses-only ctx.web search, default capability probing, and explicit probe bypass semantics are documented.",
            "path": "docs/local-core-desktop-copilot.md"
          }
        ]
      },
      "security": {
        "controlsDesktop": false,
        "capturesScreen": false,
        "usesExistingBrowserProfile": false,
        "sendsDataExternally": true,
        "approvalGate": false,
        "notes": [
          "Model prompts, images, and hosted-search queries are sent directly to GitHub Copilot by DSH's built-in pi-ai adapter and this plugin.",
          "The shared DSH credential record owns OAuth refresh; the plugin normalizes provider-owned grant fields to strict JSON, and deployment checks report only record metadata, never payload values.",
          "Hosted search does not add a separate local approval prompt, gateway process, or ACP integration.",
          "This entry pins the historical full deployment baseline, not the newer managed-route maintenance contract. See docs/copilot-managed-route.md and deployments/copilot-managed-route.policy.json for separately approved configuration-only maintenance; no implicit component upgrade or full-baseline attestation is provided."
        ]
      },
      "summary": "The locked DSH companion for Copilot sign-in, account-aware leaf-only model reconciliation, strict Host-only grant handling, provider-scoped Tool compatibility, dual-protocol inline search, and Responses-only ctx.web search through validated GitHub-hosted or Enterprise endpoints; no second adapter, embedded gateway, or ACP scope."
    },
    {
      "id": "dsh-playwright-host",
      "displayName": "DSH Playwright Host",
      "package": "dsh-playwright-host",
      "categories": [
        "browser-automation",
        "testing"
      ],
      "integration": "cordis",
      "source": {
        "repository": "https://github.com/cloga/dsh-playwright-host",
        "commit": "a7f63e2c3565008e1c614023afb1c3110fd62fff",
        "release": "0.1.2",
        "mergeCommit": "2cf6edfd52b5a70b3f6af7b1f502c58718a6f5ac",
        "pullRequest": 6
      },
      "platforms": [
        "windows"
      ],
      "recommendation": "conditional",
      "validation": {
        "level": "L4",
        "verifiedAt": "2026-09-03",
        "dshVersion": "0.1.2-rc.1",
        "nodeVersion": "24.13.0",
        "evidence": [
          {
            "kind": "source-review",
            "description": "The Host-wide shared-process and isolated-browser boundaries are reviewed and documented.",
            "path": "docs/plugins/computer-use.md"
          },
          {
            "kind": "import-probe",
            "description": "Static bundle tests and the exact a66e470 rc.1 source-seam test verify Git commit identity, packaged Release bytes, and composed MCP lifecycle markers before activation.",
            "path": "tests/host-playwright-bundle.test.mjs"
          },
          {
            "kind": "composition-mount",
            "description": "The Web profile resolves immutable v0.1.2, release artifact SHA-256, resolved commit 2cf6edfd52b5a70b3f6af7b1f502c58718a6f5ac, isolated Microsoft Edge, and the pinned MCP version.",
            "path": "tools/dsh-playwright-host/README.md"
          },
          {
            "kind": "functional-smoke",
            "description": "Host MCP navigated the existing DSH GUI, captured accessibility state, and inspected browser requests after activation.",
            "path": "docs/plugins/computer-use.md"
          }
        ]
      },
      "security": {
        "controlsDesktop": false,
        "capturesScreen": true,
        "usesExistingBrowserProfile": false,
        "sendsDataExternally": true,
        "approvalGate": false,
        "notes": [
          "Uses an isolated Edge profile but one Host-owned MCP process is shared across Sessions.",
          "Browser tools can navigate to external sites and submit user-directed data; isolation does not prevent network transmission.",
          "Optional Web overlay; not required by the Windows Copilot deployment lock."
        ]
      },
      "summary": "Optional Host-wide Playwright MCP bundle for isolated Edge testing of the existing DSH GUI.",
      "artifact": {
        "name": "dsh-playwright-host-0.1.2.tgz",
        "url": "https://github.com/cloga/dsh-playwright-host/releases/download/v0.1.2/dsh-playwright-host-0.1.2.tgz",
        "sha256": "18e4e2d29429a94f495d9507188282e6157f11c2ef75fa076b54b30c03ac0cf2",
        "size": 3659,
        "releaseTag": "v0.1.2",
        "releaseImmutable": true,
        "checksumManifestUrl": "https://github.com/cloga/dsh-playwright-host/releases/download/v0.1.2/SHA256SUMS",
        "checksumManifestSha256": "06647ede584dad3055508733f17cd720f4ebf149c2cd73d680497e7117247e84",
        "checksumManifestSize": 96
      }
    },
    {
      "id": "dsh-cron",
      "displayName": "DSH Cron",